{
  "schema": "https://fbalwy.sa/content/publications/v1",
  "schema_version": "1.0.0",
  "generated_at": "2026-08-19T01:31:00+03:00",
  "subject": {
    "preferred_name": "Faisal Albalwy",
    "orcid": "0000-0002-2342-2156"
  },
  "counting_policy": {
    "unit": "one publisher-verified work lineage",
    "canonical_record_count": 27,
    "registered_candidate_count": 28,
    "registered_included_candidate_count": 24,
    "discovered_candidate_count": 3,
    "discovered_included_candidate_count": 3,
    "included_candidate_count": 27,
    "held_candidate_count": 1,
    "excluded_or_version_linked_candidate_count": 3,
    "rules": [
      "Count a version of record once even when the supplied profile has duplicate citation rows.",
      "Link a conference presentation, preprint, or profile duplicate to the version of record rather than counting it again.",
      "Include a work only after a publisher page, DOI registration, or authoritative institutional repository verifies the bibliographic identity and Faisal identity match.",
      "Do not count held candidates, citation metrics, profile totals, corrections, or retractions as additional works.",
      "Sort by display_sort_date descending and then exact title ascending; missing month or day components are represented conservatively by the first day of the known period only for sorting."
    ]
  },
  "discovery_source": {
    "type": "google_scholar_profile",
    "url": "https://scholar.google.com/citations?hl=en&user=zkrWLDAAAAAJ&view_op=list_works&sortby=pubdate",
    "observed_at": "2026-08-19",
    "profile_rows_observed": 31,
    "registered_rows_reconciled": 28,
    "new_candidates_discovered": 3,
    "authority_note": "Discovery and identity corroboration only; no profile row was accepted without publisher, DOI-registration, or authoritative repository evidence."
  },
  "validation_summary": {
    "primary_source_backed_records": 27,
    "normalized_unique_dois": 26,
    "records_without_doi": 1,
    "unique_stable_ids": 27,
    "duplicate_work_lineages": 0,
    "correction_retraction_checks": 27,
    "corrections_found": 0,
    "retractions_found": 0,
    "last_checked_at": "2026-08-19"
  },
  "publications": [
    {
      "stable_id": "doi-10-1016-j-eswa-2026-132969",
      "title": "Hierarchical federated learning with paillier encryption: synergistic approach for secure analytics of sensitive healthcare data",
      "authors": [
        {"name": "Saeed Iqbal", "is_faisal": false},
        {"name": "Xiaopin Zhong", "is_faisal": false},
        {"name": "Muhammad Attique Khan", "is_faisal": false},
        {"name": "Zongze Wu", "is_faisal": false},
        {"name": "Nouf Abdullah Almujally", "is_faisal": false},
        {"name": "Weixiang Liu", "is_faisal": false},
        {"name": "Faisal Albalwy", "is_faisal": true, "name_variant_evidence": ["Publisher author string is Faisal Albalwy", "ORCID 0000-0002-2342-2156 work record and current Scholar coauthor/title context agree"]},
        {"name": "Amir Hussain", "is_faisal": false}
      ],
      "type": "journal_article",
      "venue": "Expert Systems with Applications",
      "publisher": "Elsevier BV",
      "doi": "10.1016/j.eswa.2026.132969",
      "doi_url": "https://doi.org/10.1016/j.eswa.2026.132969",
      "official_url": "https://www.sciencedirect.com/science/article/pii/S0957417426018816",
      "dates": [
        {"type": "issue", "value": "2026-12-01", "precision": "day", "source_url": "https://www.sciencedirect.com/science/article/pii/S0957417426018816"},
        {"type": "observed", "value": "2026-08-19", "precision": "day", "source_url": "https://www.sciencedirect.com/science/article/pii/S0957417426018816"}
      ],
      "display_year": 2026,
      "display_sort_date": "2026-12-01",
      "volume": "330",
      "issue": null,
      "pages": null,
      "article_number": "132969",
      "status": "online_first_with_future_issue_assignment",
      "abstract": null,
      "keywords": null,
      "open_access": {"status": "unknown", "license": null, "license_url": null},
      "sources": [
        {"type": "publisher_version_of_record", "url": "https://www.sciencedirect.com/science/article/pii/S0957417426018816", "accessed_at": "2026-08-19"},
        {"type": "doi_registration", "url": "https://doi.org/10.1016/j.eswa.2026.132969", "accessed_at": "2026-08-19"}
      ],
      "evidence_claim_ids": ["DISC-GS-000001"],
      "version_relationships": [],
      "correction_retraction": {"state": "none_found", "checked_at": "2026-08-19", "source_urls": ["https://doi.org/10.1016/j.eswa.2026.132969"]},
      "verification_status": "verified",
      "public_disposition": "eligible",
      "inclusion_notes": "Discovered from the current Scholar profile and independently verified by the live Elsevier record and DOI registration. The issue date is in the future relative to generation, so the record remains explicitly online-first/issue-assigned rather than silently treated as an already elapsed issue."
    },
    {
      "stable_id": "doi-10-3390-systems14040385",
      "title": "Zero-Knowledge-Based Policy Enforcement for Privacy-Preserving Cross-Institutional Health Data Sharing on Blockchain",
      "authors": [
        {"name": "Faisal Albalwy", "is_faisal": true, "name_variant_evidence": ["Publisher author string is Faisal Albalwy", "ORCID 0000-0002-2342-2156 and the Taibah University publisher affiliation match"]}
      ],
      "type": "journal_article",
      "venue": "Systems",
      "publisher": "MDPI AG",
      "doi": "10.3390/systems14040385",
      "doi_url": "https://doi.org/10.3390/systems14040385",
      "official_url": "https://www.mdpi.com/2079-8954/14/4/385",
      "dates": [{"type": "publication", "value": "2026-04-02", "precision": "day", "source_url": "https://www.mdpi.com/2079-8954/14/4/385"}],
      "display_year": 2026,
      "display_sort_date": "2026-04-02",
      "volume": "14",
      "issue": "4",
      "pages": null,
      "article_number": "385",
      "status": "published",
      "abstract": null,
      "keywords": null,
      "open_access": {"status": "open", "license": "CC BY 4.0", "license_url": "https://creativecommons.org/licenses/by/4.0/"},
      "sources": [
        {"type": "publisher_version_of_record", "url": "https://www.mdpi.com/2079-8954/14/4/385", "accessed_at": "2026-08-19"},
        {"type": "doi_registration", "url": "https://doi.org/10.3390/systems14040385", "accessed_at": "2026-08-19"}
      ],
      "evidence_claim_ids": ["DISC-GS-000002"],
      "version_relationships": [],
      "correction_retraction": {"state": "none_found", "checked_at": "2026-08-19", "source_urls": ["https://www.mdpi.com/2079-8954/14/4/385", "https://doi.org/10.3390/systems14040385"]},
      "verification_status": "verified",
      "public_disposition": "eligible",
      "inclusion_notes": "Current-profile discovery verified against the publisher version of record and DOI metadata."
    },
    {
      "stable_id": "doi-10-32604-cmc-2025-075098",
      "title": "Bridging AI and Cyber Defense: A Stacked Ensemble Deep Learning Model with Explainable Insights",
      "authors": [
        {"name": "Faisal Albalwy", "is_faisal": true, "name_variant_evidence": ["Publisher author string is Faisal Albalwy", "Publisher page gives Taibah University affiliation and matches ORCID/profile topic context"]},
        {"name": "Muhannad Almohaimeed", "is_faisal": false}
      ],
      "type": "journal_article",
      "venue": "Computers, Materials & Continua",
      "publisher": "Tech Science Press",
      "doi": "10.32604/cmc.2025.075098",
      "doi_url": "https://doi.org/10.32604/cmc.2025.075098",
      "official_url": "https://www.techscience.com/cmc/v87n2/66604/html",
      "dates": [
        {"type": "accepted", "value": "2025-12-17", "precision": "day", "source_url": "https://www.techscience.com/cmc/v87n2/66604/html"},
        {"type": "issue", "value": "2026-03-12", "precision": "day", "source_url": "https://www.techscience.com/cmc/v87n2/66604/html"}
      ],
      "display_year": 2026,
      "display_sort_date": "2026-03-12",
      "volume": "87",
      "issue": "2",
      "pages": null,
      "article_number": "23",
      "status": "published",
      "abstract": null,
      "keywords": null,
      "open_access": {"status": "open", "license": "CC BY 4.0", "license_url": "https://creativecommons.org/licenses/by/4.0/"},
      "sources": [
        {"type": "publisher_version_of_record", "url": "https://www.techscience.com/cmc/v87n2/66604/html", "accessed_at": "2026-08-19"},
        {"type": "doi_registration", "url": "https://doi.org/10.32604/cmc.2025.075098", "accessed_at": "2026-08-19"}
      ],
      "evidence_claim_ids": ["DISC-GS-000003"],
      "version_relationships": [],
      "correction_retraction": {"state": "none_found", "checked_at": "2026-08-19", "source_urls": ["https://www.techscience.com/cmc/v87n2/66604/html", "https://doi.org/10.32604/cmc.2025.075098"]},
      "verification_status": "verified",
      "public_disposition": "eligible",
      "inclusion_notes": "The DOI suffix contains 2025, but the publisher controls the bibliographic year and identifies this as volume 87, issue 2 (2026), issued 12 March 2026."
    },
    {
      "stable_id": "doi-10-1016-j-aej-2025-06-011",
      "title": "Design and implementation of a decentralized trustless data standardization framework for blockchain interoperability using smart contracts",
      "authors": [
        {"name": "Abdulrahman Alzahrani", "is_faisal": false},
        {"name": "Amin Noaman", "is_faisal": false},
        {"name": "Ahmed A.A. Gad-Elrab", "is_faisal": false},
        {"name": "Fathy Eassa", "is_faisal": false},
        {"name": "Maher Khemakhem", "is_faisal": false},
        {"name": "Faisal Albalwy", "is_faisal": true, "name_variant_evidence": ["Publisher author string is Faisal Albalwy", "ORCID work record and recurring verified coauthor set match"]},
        {"name": "Hosam Aljihani", "is_faisal": false}